{
  "file": "patchbays.json",
  "category": "patchbays",
  "generated": "2026-10-22",
  "selection_rationale": "The set covers the four sub_types: TT/Bantam studio and broadcast bays (Switchcraft StudioPatch 9625/6425, Bittree 969-A, Neutrik NPPA-TT-PT), 6.35 mm TRS project-studio bays (Samson S-Patch Plus, Neutrik NYS-SPP-L1), an XLR tie-line panel (Canare 162U-X21) and a 75-ohm video patchbay (Canare 32MD-ST). Each one shows a different way of choosing the normalling: a front screwdriver cam (Switchcraft EZ Norm), a front mini-toggle (Samson), shunts under the designation strips (Bittree), a reversible PCB card (Neutrik NYS), swappable pre-configured jack pairs and normalling bars (Neutrik NPPA), and a mode fixed by the fitted jack type (Canare). Between them they cover normalled, half-normalled (bottom and top row), non-normalled/isolated, parallel and switchable operation. All of these documents were read directly; the Behringer PX3000 was dropped because no manufacturer page could be reached.",
  "not_found_log": [
    { "device_id": "behringer-px3000", "what": "Product page, specs and manual (device dropped)", "searched": "behringer.com sitemap.xml (no product URLs), behringer.com/en/products (no PX3000), behringer.com/en/products/px3000 (Product Not Found), thomann.de -> thomann.fr (404); WebSearch refused (search budget exhausted)" },
    { "device_id": "mosses-mitchell", "what": "Manufacturer site for a Mosses & Mitchell broadcast jackfield", "searched": "www.mosses-mitchell.com (DNS not found); WebSearch refused (search budget exhausted)" },
    { "device_id": "switchcraft-studiopatch-9625", "what": "Official user manual and switchcraft.com product page", "searched": "switchcraft.com home and search.php (JS-rendered, empty), switchcraft.com sitemap.xml (first 100k chars, no StudioPatch URL); only the Switchcraft StudioPatch sell sheet PDF found. The customer drawing is reachable only on markertek.com" },
    { "device_id": "switchcraft-studiopatch-6425", "what": "Official user manual and switchcraft.com product page", "searched": "same as 9625; Sweetwater, Canford and Full Compass pages returned 403" },
    { "device_id": "samson-s-patch-plus", "what": "Dimensions, weight, year introduced", "searched": "samsontech.com product page and owner's manual v1 (neither lists them)" },
    { "device_id": "bittree-969a-2x48-1-5ru", "what": "Data sheet PDF and year introduced", "searched": "bittree.com product page (no data sheet listed), programming-instructions pages" },
    { "device_id": "canare-32md-st", "what": "Manual / drawing PDF", "searched": "canare.co.jp product page (drawings only sent by e-mail via a download form), canare.com productspecsanddrawings and catalog pages (no direct PDFs)" },
    { "device_id": "canare-162u-x21", "what": "Manual / drawing PDF, pin wiring of XJ3 adapters", "searched": "canare.co.jp pages tid=5_010 and tid=5_025 (drawings gated by a form)" },
    { "device_id": "*", "what": "French-language manuals", "searched": "No French manual on Samson, Neutrik (catalog section 07 is German), Switchcraft, Bittree or Canare pages reached" }
  ],
  "devices": [
    {
      "id": "switchcraft-studiopatch-9625",
      "brand": "Switchcraft",
      "model": "StudioPatch 9625",
      "category": "patchbays",
      "sub_type": "tt-bantam",
      "technology": "1RU TT (Bantam) patchbay, 48 channels (96 TT/bantam jacks), DB25 rear I/O wired to the TASCAM DTRS pinout, EZ Norm front-programmable normalling jacks, programmable grounds",
      "year_introduced": 2007,
      "status": "current",
      "why_it_is_a_classic": "Switchcraft itself calls the 9625 the patchbay of choice for professional recording studios, broadcast facilities and mobile production units. Its DB25 pinout matches common interfaces, so it is a frequent front end for Pro Tools-type rigs.",
      "typical_uses": ["recording studio", "broadcast facility", "mobile production unit", "audio interface I/O patching"],
      "key_specs": {
        "channels": "48 channels (96 TT/bantam jacks)",
        "rack_units": "1RU",
        "rear_connectors": "DB25 I/O connections, wired to the TASCAM DTRS pinout",
        "db25_pinout_channel_1": "Tip (hot) 24, Ring (cold) 12, Sleeve (ground) 25 (DB25 wiring chart on the Switchcraft customer drawing)",
        "channels_per_db25": "8 (CHANNEL 1-8 on the connector pinout of the drawing)",
        "normalling": {
          "modes_supported": ["normalled (F: Full normal)", "half-normalled (H: Half normal)", "non-normalled (N: Non-normal)"],
          "switchable": true,
          "how_switched": "Per channel, from the front of the bay: EZ Norm jack, 'change the signal flow of each channel from Full, to Half, to Non-normalled with the twist of a standard screwdriver' (rotating cam between the jack pair, per Mix)",
          "default": "not stated"
        },
        "grounding": "Programmable ground switches per channel: Up = sleeves vertically strapped, Down = sleeves isolated (drawing: accessed with top cover removed)",
        "chassis": "Blue anodized aluminum with white laser etched text (drawing note)",
        "included": "1 Foot Black TT Patch Cord (Markertek)"
      },
      "connectors": [
        { "connector": "tt-bantam", "role": "front patch jacks (top and bottom rows)", "dir": "bidir", "signal": "line-level-pro", "count": 96 },
        { "connector": "dsub25", "role": "rear I/O, 8 channels per connector, TASCAM DTRS pinout", "dir": "bidir", "signal": "line-level-pro", "count": "not stated by manufacturer" }
      ],
      "signal_types": ["line-level-pro"],
      "manual_url": "not found",
      "datasheet_url": "https://www.switchcraft.com/assets/1/27/1625,_9625,_EZ_NORM_SG.pdf",
      "product_page_url": "not found",
      "manual_languages": ["en"],
      "manuals": [
        { "url": "https://www.switchcraft.com/assets/1/27/1625,_9625,_EZ_NORM_SG.pdf", "title": "StudioPatch Series Audio Patchbays (New Product Bulletin 563C) with NPB #584 and #579B", "language": "en", "file_type": "pdf", "version_or_date": "NPB 563C", "official": true, "kind": "datasheet" }
      ],
      "sources": [
        { "url": "https://www.switchcraft.com/assets/1/27/1625,_9625,_EZ_NORM_SG.pdf", "publisher": "Switchcraft", "accessed": "2026-10-22", "confidence": "verified-primary", "kind": "manufacturer", "covers": ["technology", "key_specs.normalling", "key_specs.grounding", "key_specs.rear_connectors", "key_specs.rack_units"] },
        { "url": "https://cdn.eicom.ru/media/PDF/5100379.pdf", "publisher": "Switchcraft (NPB 563C, hosted by distributor eicom)", "accessed": "2026-10-22", "confidence": "verified-secondary", "kind": "other", "covers": ["key_specs.channels", "key_specs.rack_units", "key_specs.normalling", "key_specs.grounding", "why_it_is_a_classic"] },
        { "url": "http://www.markertek.com/Attachments/Specifications/Switchcraft/9625-Specifications.pdf", "publisher": "Switchcraft customer drawing 9625 rev 0A (hosted by Markertek)", "accessed": "2026-10-22", "confidence": "verified-secondary", "kind": "retailer", "covers": ["key_specs.db25_pinout_channel_1", "key_specs.channels_per_db25", "key_specs.normalling", "key_specs.grounding", "key_specs.chassis"] },
        { "url": "https://www.markertek.com/product/sw-9625/switchcraft-9625-studiopatch-96-patch-points-to-db25-programmable-grounds", "publisher": "Markertek", "accessed": "2026-10-22", "confidence": "verified-secondary", "kind": "retailer", "covers": ["key_specs.included", "key_specs.normalling", "status"] },
        { "url": "https://www.mixonline.com/?p=79561", "publisher": "Mix (Switchcraft Introduces StudioPatch Series Patchbays, 06/27/2007)", "accessed": "2026-10-22", "confidence": "verified-secondary", "kind": "trade-press", "covers": ["year_introduced", "key_specs.normalling", "key_specs.channels"] }
      ],
      "notes": "Switchcraft documents name the three positions (F, H, N) but do not spell out the signal flow; the behaviour below follows Samson's S-Patch Plus manual and Neutrik's patch panel catalog definitions. F (full normal): with no cord, the top-rear output feeds the bottom-rear input; a plug in the top jack takes the output and breaks the link, and a plug in the bottom jack feeds the input and also breaks it. H (half normal): a plug in the top jack takes a parallel copy without breaking the link (monitoring/split), while a plug in the bottom jack breaks the link. N (non-normal): top and bottom are independent; nothing reaches the bottom row unless a cord is patched. Grounds are set separately with the strap/isolate switches. The DB25 count is not stated by Switchcraft; one Reverb listing (search snippet) counts 12.",
      "conflicts": [],
      "tekpractice": { "in_catalog": true, "catalog_id": "switchcraft-studiopatch-9625", "proposed_new_connectors": [], "proposed_new_signals": [], "sim_value": "high", "sim_value_reason": "Already in the catalog; teaches F/H/N normalling, sleeve strapping and the DB25 TASCAM pinout" }
    },
    {
      "id": "switchcraft-studiopatch-6425",
      "brand": "Switchcraft",
      "model": "StudioPatch 6425",
      "category": "patchbays",
      "sub_type": "tt-bantam",
      "technology": "1RU TT (Bantam) patchbay, 32 channels (64 TT/bantam jacks), DB25 I/O (TASCAM DTRS pinout), EZ Norm front-programmable normalling, programmable grounds",
      "year_introduced": 2007,
      "status": "current",
      "why_it_is_a_classic": "This is the 32-channel version of the StudioPatch 9625. Switchcraft aims it at fixed installations in studios that need less patching than a standard 48-channel bay.",
      "typical_uses": ["fixed studio installation", "smaller studio I/O patching"],
      "key_specs": {
        "channels": "32 channels (64 TT/bantam jacks)",
        "rack_units": "1RU",
        "rear_connectors": "DB25 I/O connections wired to the TASCAM DTRS pinout",
        "normalling": {
          "modes_supported": ["normalled (F)", "half-normalled (H)", "non-normalled (N)"],